{
  "task_id": "BUILD_GREETING_SERVER",
  "base_revision": 0,
  "scope": [
    "program"
  ],
  "operations": [
    {
      "op": "import_text",
      "source": "@id(\"core\") module core visibility public {\n  @id(\"core.File\") type File = record { slot: U64, generation: U64 } layout opaque;\n  @id(\"core.Deadline\") type Deadline = sum { Infinite, At(U64) };\n  @id(\"core.IoError\") type IoError = sum { Read, Write, Closed, Timeout, PermissionDenied, InvalidData, Other };\n  @id(\"core.AllocError\") type AllocError = sum { OutOfMemory, CapacityOverflow };\n\n  @id(\"core.infinite\") fn infinite() -> Deadline {\n    return Deadline::Infinite();\n  }\n  @id(\"core.deadline_at\") fn deadline_at(instant: U64) -> Deadline {\n    return Deadline::At(instant);\n  }\n  @id(\"core.max_i64\") fn max_i64(left: I64, right: I64) -> I64 {\n    if left > right { return left; }\n    return right;\n  }\n}\n\n@id(\"alloc\") module alloc visibility public imports [core] {\n  @id(\"alloc.StringResult\") type StringResult = Result<String, core.AllocError>;\n\n  @id(\"alloc.concat\") fn concat(left: String, right: String) -> StringResult effects [alloc] {\n    return runtime.string_concat(left, right);\n  }\n  @id(\"alloc.clone_string\") fn clone_string(value: String) -> String effects [alloc] {\n    return clone(value);\n  }\n  @id(\"alloc.clone_bytes\") fn clone_bytes(value: Bytes) -> Bytes effects [alloc] {\n    return clone(value);\n  }\n  @id(\"alloc.string_size\") fn string_size(value: String) -> Usize {\n    return runtime.string_len(value);\n  }\n  @id(\"alloc.bytes_size\") fn bytes_size(value: Bytes) -> Usize {\n    return runtime.bytes_len(value);\n  }\n}\n\n@id(\"io\") module io visibility public imports [core] {\n  @id(\"io.UnitResult\") type UnitResult = Result<Unit, core.IoError>;\n  @id(\"io.BytesResult\") type BytesResult = Result<Bytes, core.IoError>;\n  @id(\"io.CountResult\") type CountResult = Result<Usize, core.IoError>;\n\n  @id(\"io.print_string\") fn print_string(value: String) -> UnitResult effects [process] {\n    return runtime.print_string(value);\n  }\n  @id(\"io.print_i64\") fn print_i64(value: I64) -> UnitResult effects [process] {\n    return runtime.print_i64(value);\n  }\n  @id(\"io.read_stdin\") fn read_stdin(maximum: Usize, deadline: core.Deadline) -> BytesResult effects [process, alloc] {\n    return runtime.stdin_read(maximum, deadline);\n  }\n  @id(\"io.write_stdout\") fn write_stdout(value: Bytes, deadline: core.Deadline) -> CountResult effects [process] {\n    let length: Usize = runtime.bytes_len(value);\n    let mut offset: Usize = 0;\n    while offset < length {\n      let count: Usize = runtime.stdout_write(value, offset, deadline)?;\n      if count == 0 { return Err(core.IoError::Write()); }\n      offset = offset + count;\n    }\n    return Ok(offset);\n  }\n  @id(\"io.write_stderr\") fn write_stderr(value: Bytes, deadline: core.Deadline) -> CountResult effects [process] {\n    let length: Usize = runtime.bytes_len(value);\n    let mut offset: Usize = 0;\n    while offset < length {\n      let count: Usize = runtime.stderr_write(value, offset, deadline)?;\n      if count == 0 { return Err(core.IoError::Write()); }\n      offset = offset + count;\n    }\n    return Ok(offset);\n  }\n  @id(\"io.close_file\") fn close_file(file: core.File) -> UnitResult effects [fs] {\n    return runtime.file_close(file);\n  }\n}\n\n@id(\"time\") module time visibility public imports [core] {\n @id(\"time.deadline_after_ms\") fn deadline_after_ms(now:U64,milliseconds:U64)->core.Deadline {let instant:U64=now+milliseconds*1000000;return core.Deadline::At(instant);}\n @id(\"time.elapsed_ns\") fn elapsed_ns(start:U64,finish:U64)->U64 {return finish-start;}\n @id(\"time.expired\") fn expired(deadline:core.Deadline,now:U64)->Bool {match deadline {Infinite=>{return false;}At(instant)=>{return now>=instant;}}}\n}\n\n@id(\"net\") module net visibility public imports [core] {\n @id(\"net.Listener\") type Listener=record {slot:U64,generation:U64} layout opaque;\n @id(\"net.Stream\") type Stream=record {slot:U64,generation:U64} layout opaque;\n @id(\"net.ListenerResult\") type ListenerResult=Result<Listener,core.IoError>;\n @id(\"net.StreamResult\") type StreamResult=Result<Stream,core.IoError>;\n @id(\"net.UnitResult\") type UnitResult=Result<Unit,core.IoError>;\n @id(\"net.CountResult\") type CountResult=Result<Usize,core.IoError>;\n @id(\"net.write_all\") fn write_all(stream:Stream,data:Bytes,deadline:core.Deadline)->CountResult effects [net] {\n  let length:Usize=runtime.bytes_len(data);let mut offset:Usize=0;\n  while offset<length {let count:Usize=runtime.net_write(stream,data,offset,deadline)?;if count==0{return Err(core.IoError::Write());}offset=offset+count;}\n  return Ok(offset);\n }\n @id(\"net.close_stream\") fn close_stream(stream:Stream)->UnitResult effects [net] {return runtime.net_close_stream(stream);}\n @id(\"net.close_listener\") fn close_listener(listener:Listener)->UnitResult effects [net] {return runtime.net_close_listener(listener);}\n}\n\n@id(\"json\") module json visibility public imports [core] {\n @id(\"json.BytesResult\") type BytesResult=Result<Bytes,core.IoError>;\n @id(\"json.hex_digit\") fn hex_digit(n:U8)->U8 {if n<10{return n+48;}return n+87;}\n @id(\"json.quote\") fn quote(value:String)->BytesResult effects [alloc] {\n  let data:Bytes=runtime.string_to_bytes(value)?;\n  let mut output:Bytes=runtime.bytes_from_u8(34)?;\n  let length:Usize=runtime.bytes_len(data);let mut index:Usize=0;\n  while index<length {\n   let byte:U8=runtime.bytes_get(data,index);\n   if byte==34 {let escaped:Bytes=runtime.string_to_bytes(\"\\\\\\\"\")?;output=runtime.bytes_concat(output,escaped)?;}\n   else if byte==92 {let escaped:Bytes=runtime.string_to_bytes(\"\\\\\\\\\")?;output=runtime.bytes_concat(output,escaped)?;}\n   else if byte<32 {let prefix:Bytes=runtime.string_to_bytes(\"\\\\u00\")?;let high:Bytes=runtime.bytes_from_u8(hex_digit(byte/16))?;let low:Bytes=runtime.bytes_from_u8(hex_digit(byte%16))?;output=runtime.bytes_concat(output,prefix)?;output=runtime.bytes_concat(output,high)?;output=runtime.bytes_concat(output,low)?;}\n   else {let literal:Bytes=runtime.bytes_from_u8(byte)?;output=runtime.bytes_concat(output,literal)?;}\n   index=index+1;\n  }\n  let quote:Bytes=runtime.bytes_from_u8(34)?;return runtime.bytes_concat(output,quote);\n }\n @id(\"json.message\") fn message(value:String)->BytesResult effects [alloc] {\n  let quoted:Bytes=quote(value)?;let prefix:Bytes=runtime.string_to_bytes(\"{\\\"message\\\":\")?;let suffix:Bytes=runtime.bytes_from_u8(125)?;\n  let head:Bytes=runtime.bytes_concat(prefix,quoted)?;return runtime.bytes_concat(head,suffix);\n }\n}\n\n@id(\"http\") module http visibility public imports [core,net] {\n @id(\"http.HttpError\") type HttpError=sum {Protocol(U16),Io(core.IoError),Handler};\n @id(\"http.Request\") type Request=sum {Parsed(Bytes,Bytes)};\n @id(\"http.EmptyRequest\") type EmptyRequest=sum {Empty};\n @id(\"http.PathRequest\") type PathRequest=sum {Path(String)};\n @id(\"http.ParseResult\") type ParseResult=Result<Request,HttpError>;\n @id(\"http.Read\") type Read=sum {Read(net.Stream,ParseResult)};\n @id(\"http.Response\") type Response=sum {Response(U16,String,Bytes)};\n @id(\"http.ResponseResult\") type ResponseResult=Result<Response,HttpError>;\n @id(\"http.PathMatch\") type PathMatch=sum {Miss,Match(String)};\n @id(\"http.MatchResult\") type MatchResult=Result<PathMatch,HttpError>;\n @id(\"http.BytesResult\") type BytesResult=Result<Bytes,core.IoError>;\n @id(\"http.StringResult\") type StringResult=Result<String,core.IoError>;\n @id(\"http.UnitResult\") type UnitResult=Result<Unit,core.IoError>;\n @id(\"http.Scan\") type Scan=sum {Parsed(Bytes,Bytes),Rejected(U16)};\n @id(\"http.StatusResult\") type StatusResult=Result<U16,core.IoError>;\n @id(\"http.ScanResult\") type ScanResult=Result<Scan,core.IoError>;\n @id(\"http.PathScan\") type PathScan=sum {Decoded(Bytes),Rejected(U16)};\n @id(\"http.PathScanResult\") type PathScanResult=Result<PathScan,core.IoError>;\n @id(\"http.lower_ascii\") fn lower_ascii(byte:U8)->U8 {if byte>=65 {if byte<=90{return byte+32;}}return byte;}\n @id(\"http.token\") fn token(byte:U8)->Bool {\n  if byte>=65{if byte<=90{return true;}}\n  if byte>=97{if byte<=122{return true;}}\n  if byte>=48{if byte<=57{return true;}}\n  if byte==33{return true;}if byte==35{return true;}if byte==36{return true;}if byte==37{return true;}if byte==38{return true;}if byte==39{return true;}if byte==42{return true;}if byte==43{return true;}if byte==45{return true;}if byte==46{return true;}if byte==94{return true;}if byte==95{return true;}if byte==96{return true;}if byte==124{return true;}if byte==126{return true;}return false;\n }\n @id(\"http.hex_value\") fn hex_value(byte:U8)->U16 {\n  if byte>=48{if byte<=57{return cast<U16>(byte-48);}}\n  if byte>=65{if byte<=70{return cast<U16>(byte-55);}}\n  if byte>=97{if byte<=102{return cast<U16>(byte-87);}}\n  return 256;\n }\n @id(\"http.decode_path\") fn decode_path(raw:Bytes)->PathScanResult effects [alloc] {\n  let length:Usize=runtime.bytes_len(raw);let mut index:Usize=0;let mut output:Bytes=runtime.string_to_bytes(\"\")?;\n  while index<length {\n   let mut byte:U8=runtime.bytes_get(raw,index);\n   if byte==37 {\n    if length-index<3{return Ok(PathScan::Rejected(400));}\n    let high:U16=hex_value(runtime.bytes_get(raw,index+1));let low:U16=hex_value(runtime.bytes_get(raw,index+2));\n    if high>15{return Ok(PathScan::Rejected(400));}if low>15{return Ok(PathScan::Rejected(400));}\n    byte=cast<U8>(high*16+low);if byte==47{return Ok(PathScan::Rejected(400));}if byte==0{return Ok(PathScan::Rejected(400));}index=index+2;\n   }\n   if byte==0{return Ok(PathScan::Rejected(400));}\n   let one:Bytes=runtime.bytes_from_u8(byte)?;output=runtime.bytes_concat(output,one)?;index=index+1;\n  }\n  let utf8:StringResult=runtime.string_from_utf8(output);\n  match utf8 {Ok(text)=>{return Ok(PathScan::Decoded(outpu